{
  "$schema": "../../schemas/family-blueprint.schema.json",
  "schema_version": "1.0.0",
  "family_id": "wtb-researcher",
  "family_title": "WTB Researcher",
  "owning_environment": "normsexchange-dev",
  "publisher": {
    "owner": "normsexchange-dev",
    "repository": "normsexchange-dev/nx-agent-blueprints_dev"
  },
  "family_version": "0.2.0",
  "lifecycle_state": "stable",
  "purpose": "Research evidence-backed demand for professional motion-picture production equipment.",
  "nonpurpose": [
    "Buyer outreach",
    "Buyer confirmation",
    "Norms verification",
    "Commerce or listing publication",
    "Agent or mission activation"
  ],
  "parent": null,
  "compatibility": {
    "genesis": [
      "communications-v0.6.0"
    ],
    "communications": [
      "0.6.0"
    ]
  },
  "supported_runtime_families": [
    "neutral",
    "codex",
    "gemini",
    "claude"
  ],
  "input_types": [
    "untrusted-public-source-reference",
    "research-question"
  ],
  "output_types": [
    "research-candidate-proposal",
    "evidence-summary"
  ],
  "required_provenance": [
    "source URL or immutable reference",
    "source publication date when known",
    "research time",
    "claim classification",
    "synthetic marker when applicable"
  ],
  "tools": {
    "required": [
      "read-only source retrieval",
      "deterministic contract validator"
    ],
    "optional": [
      "read-only browser",
      "local index"
    ]
  },
  "declared_capabilities": [
    "research public evidence",
    "create internal proposals after separate activation"
  ],
  "external_capabilities_not_granted": [
    "outreach",
    "buyer_confirmed assignment",
    "norms_verified assignment",
    "Shopify mutation",
    "commerce mutation",
    "customer creation",
    "listing publication",
    "repository access grant",
    "message publication"
  ],
  "files": {
    "knowledge": [
      "KNOWLEDGE.md"
    ],
    "playbook": [
      "PLAYBOOK.md"
    ],
    "boundaries": [
      "BOUNDARIES.md"
    ],
    "tools": [
      "TOOLS.md"
    ],
    "evaluation": [
      "EVALUATION.md",
      "tests/evaluations.json",
      "tests/foreign-learning-adverse.json"
    ],
    "examples": [
      "examples/fictional-research-candidate.json"
    ]
  },
  "file_hashes": {
    "BOUNDARIES.md": "8af50cd621aa4db07a684446dce0ac55dabc5efef36dcc1d057a4e664c7d64c4",
    "CHANGELOG.md": "8a0c87334327b3f597e0c2788999a940b4e06cc763620b897c0f63f9e45d5291",
    "EVALUATION.md": "64a1e4caad50106fa6b1e47d20e56e154547ca742da5824513b5cd3015195780",
    "KNOWLEDGE.md": "2d2027867d30542bfcb49a2c7154c4076c402cf578e5252fd388efb2ee2cf16d",
    "PLAYBOOK.md": "3a76daf014a547e209e977e0f046b7dcfca383d6a6fdd0d67c8b57b57b867b92",
    "PURPOSE.md": "5a00190a14d92ba4733f7010f5bf0c88a3f009344b2c6829dc164c0533ba2f2c",
    "TOOLS.md": "e81107d74457816707ef3168c1daf58d006f2cdd6454c76975f352ff4276f459",
    "examples/fictional-research-candidate.json": "e4c4039374414cd162bf9e6b3db2a18ee908f141cb90bb3ec32639aa9f0b0074",
    "schemas/research-candidate.schema.json": "53de0a628cd0ef36ab052883bed20f2e43fc420781bfa98f5ef6f30825a0cef1",
    "tests/evaluations.json": "f2aac37f8503617faa2be2df7afaae3ba458e46a73fdfb45af1cb31239739599",
    "tests/foreign-learning-adverse.json": "c7992955ae1f4c1aa3ed4cb73d75b790e0ee86ddb37b3f65c546678a23863648"
  },
  "release": {
    "tag": "blueprints-v0.2.0",
    "tag_object": "resolve-from-annotated-tag",
    "tag_target": "resolve-from-annotated-tag",
    "package_digest": "b8c4c52aa856f7200f0386a5ae7dd6624b5d03dcfb95913787e4dd95b50b4f6c"
  },
  "superseded_release": "blueprints-v0.1.1",
  "deprecation": null,
  "created_at": "2026-08-28T00:00:00Z",
  "updated_at": "2026-08-29T02:00:00Z"
}
